n,cc,y,r,rat,f,d
Una Brands,SGP,2020,variant,"Una Brands acquires e-commerce businesses from marketplace sellers across Asia-Pacific, operating as a Thrasio-for-APAC aggregator.",ecommerce_horizontal__fba_brand_aggregator,una-brands.com
GlobalBees,IND,2021,variant,"GlobalBees finds and scales existing product brands in India, operating the Thrasio acquire-and-operate aggregator model for the Indian market.",ecommerce_horizontal__fba_brand_aggregator,globalbees.com
Mensa Brands,IND,2021,variant,"Mensa Brands partners with and acquires digital-first brands in India to scale them, replicating the Thrasio aggregator model for Indian D2C brands.",ecommerce_horizontal__fba_brand_aggregator,mensabrands.com
Merama,MEX,2020,variant,"Merama acquires and scales digitally native brands across Latin America, applying the Thrasio acquire-and-operate playbook to the LatAm e-commerce market.",ecommerce_horizontal__fba_brand_aggregator,merama.io
Yiguo.com,CHN,2005,variant,"Former anchor, demoted in Phase 3b re-election. Original rationale: Yiguo is the anchor company—an online-first fresh food e-commerce platform in China with cold-chain delivery of produce, meat, and seafood.",ecom_vertical__fresh_food_ecommerce,yiguo.com
Benlai,CHN,2012,variant,Benlai is a known-example Chinese fresh produce e-commerce platform focused on premium farm-to-consumer perishable delivery with cold-chain logistics.,ecom_vertical__fresh_food_ecommerce,benlai.com
Missfresh,CHN,2014,variant,Missfresh is a known-example Chinese fresh food e-commerce platform operating distributed mini-warehouses for rapid cold-chain delivery of perishables to urban consumers.,ecom_vertical__fresh_food_ecommerce,missfresh.cn
Licious,IND,2015,variant,"Licious is a known-example online-first meat and seafood platform in India with end-to-end cold-chain control, replicating the Yiguo model for the Indian market.",ecom_vertical__fresh_food_ecommerce,licious.in
Dingdong Maicai,CHN,2017,variant,"Dingdong Maicai is a leading Chinese fresh vegetable and produce e-commerce platform with proprietary cold-chain fulfillment delivering perishable foods directly to urban consumers, directly replicating the Yiguo-like playbook.",ecom_vertical__fresh_food_ecommerce,100.me
Womai,CHN,2008,variant,"Womai is a known-example B2C healthy/fresh food shopping platform in China, directly competing with Yiguo in the same geography and mechanism.",ecom_vertical__fresh_food_ecommerce,womai.com
Market Kurly,KOR,2015,variant,"Market Kurly is a South Korean online-first fresh food e-commerce platform renowned for its proprietary cold-chain 'dawn delivery' logistics, specializing in fresh produce, meat, seafood, and dairy — a direct geo-variant of the Yiguo playbook.",ecom_vertical__fresh_food_ecommerce,kurly.com
Sky Mavis,SGP,2019,variant,"Sky Mavis built Axie Infinity, a play-to-earn blockchain game with NFT creatures and marketplace, replicating the Dapper Labs model from Singapore.",crypto__nft_blockchain_gaming,skymavis.com
Sorare,FRA,2018,variant,"Sorare is a French NFT-based fantasy football platform where users buy, trade, and play with officially licensed digital cards as NFTs.",crypto__nft_blockchain_gaming,sorare.com
Animoca Brands,HKG,2014,variant,Hong Kong-based Animoca Brands builds and publishes blockchain games and NFT digital collectible experiences with true digital ownership across multiple titles.,crypto__nft_blockchain_gaming,animocabrands.com
Mythical Games,USA,2018,variant,Mythical Games develops blockchain-based video games like Blankos Block Party where in-game items are player-owned NFTs tradeable on a marketplace.,crypto__nft_blockchain_gaming,mythicalgames.com
Candy Digital,USA,2021,variant,"Candy Digital is a US-based NFT digital collectibles platform offering officially licensed sports NFTs (MLB) that fans can buy and trade, fitting the sports collectibles variant.",crypto__nft_blockchain_gaming,candy.io
Immutable Systems,AUS,2018,edge_case,"Immutable built Gods Unchained (blockchain card game with NFT ownership) and a gaming-focused NFT platform, replicating the model from Australia.",crypto__nft_blockchain_gaming,immutable.com
Yuga Labs,USA,2021,edge_case,"Yuga Labs creates NFT digital collectibles (BAYC, CryptoPunks) and has expanded into blockchain gaming (Otherside), though its origins lean more toward PFP collectibles than gaming.",crypto__nft_blockchain_gaming,yuga.com
Getir,TUR,2015,variant,"Getir pioneered the same 1P-inventory dark-store rapid-delivery model in Turkey (2015) and later expanded to Europe, making it a textbook geographic clone.",quick_commerce__dark_store_instant_delivery,getir.com
Gorillas,DEU,2020,variant,"Gorillas operated company-owned dark stores in Germany and other European cities delivering groceries within 10 minutes, a direct Gopuff/Getir clone.",quick_commerce__dark_store_instant_delivery,gorillas.io
Flink,DEU,2020,variant,"Flink operates its own dark-store network in Germany promising 10-minute grocery delivery, a clear European geographic clone of the Gopuff model.",quick_commerce__dark_store_instant_delivery,goflink.com
blinkit,IND,2013,variant,"Blinkit (formerly Grofers) pivoted to a dark-store quick-commerce model in India delivering groceries and essentials within 10–20 minutes.",quick_commerce__dark_store_instant_delivery,blinkit.com
Zepto,IND,2021,variant,"Zepto operates a network of dark stores in Indian cities delivering groceries within 10 minutes, a direct Indian adaptation of the quick-commerce playbook.",quick_commerce__dark_store_instant_delivery,zeptonow.com
JOKR,LUX,2021,variant,"JOKR stocks 5k–10k SKUs in its own micro-fulfillment centers and delivers groceries within minutes, operating the Gopuff model primarily in Latin America.",quick_commerce__dark_store_instant_delivery,jokr.com
Ninja,SAU,2022,edge_case,"Ninja is a quick-commerce operator in Saudi Arabia delivering groceries and essentials rapidly, likely using dark stores, though its 'marketplace' descriptor introduces some uncertainty about 1P inventory ownership.",quick_commerce__dark_store_instant_delivery,ananinja.com
Personio,DEU,2015,variant,"Comprehensive cloud HR platform purpose-built for European SMEs with deep localization for German and EU labor/payroll regulations — a clear Workday-for-Europe play.",enterprise_saas_horizontal__cloud_hr_platform,personio.com
Darwinbox,IND,2015,variant,"End-to-end enterprise HR platform covering the full employee lifecycle, localized for Indian and Southeast Asian labor-law and statutory compliance.",enterprise_saas_horizontal__cloud_hr_platform,darwinbox.com
SmartHR,JPN,2013,variant,Cloud-native HR management platform built specifically for the Japanese market with localization for Japan's complex labor and social-insurance regulations.,enterprise_saas_horizontal__cloud_hr_platform,smarthr.co.jp
Beisen,CHN,2002,variant,"China-based talent management and HR platform providing localized HCM capabilities for Chinese enterprises — Workday for China.",enterprise_saas_horizontal__cloud_hr_platform,beisen.com
Factorial,ESP,2016,variant,"All-in-one HR platform automating payroll, time tracking, recruitment, and performance for European SMEs with strong Spanish and EU labor-law localization.",enterprise_saas_horizontal__cloud_hr_platform,factorialhr.com
Employment Hero,AUS,2014,variant,"Cloud-based HR, payroll, and benefits platform localized for Australian and regional employment regulations — Workday for Australia/ANZ SMEs.",enterprise_saas_horizontal__cloud_hr_platform,employmenthero.com
N26,DEU,2013,variant,"N26 is a known-example mobile-only consumer neobank in Germany/Europe offering fee-free accounts and debit cards, directly replicating the Chime model.",fintech_neobanking__consumer_neobank,n26.com
Monzo,GBR,2015,variant,Monzo is a known-example UK mobile-only neobank providing fee-free current accounts with debit cards and modern money-management tools.,fintech_neobanking__consumer_neobank,monzo.com
Lunar,DNK,2015,variant,Lunar is a known-example Danish mobile-only consumer neobank offering fee-free accounts and premium tiers in Scandinavia.,fintech_neobanking__consumer_neobank,lunar.app
"Ualá",ARG,2017,edge_case,"Ualá offers Argentine consumers a fee-free mobile banking app with a prepaid/debit Mastercard, replicating the Chime model in a moderately banked Latin American market.",fintech_neobanking__consumer_neobank,uala.com.ar
Neon,BRA,2016,edge_case,"Neon is a Brazilian digital bank offering checking accounts with debit cards, low/no fees, and lending products—an account-first consumer neobank distinct from the credit-card-first Nubank model.",fintech_neobanking__consumer_neobank,neon.com.br
C6 Bank,BRA,2018,edge_case,"C6 Bank is a Brazilian mobile-first digital bank offering checking accounts with debit cards and multiple financial products, broadly matching the consumer neobank mechanism.",fintech_neobanking__consumer_neobank,c6bank.com.br
Bird,USA,2017,variant,"Bird operates a dockless shared e-scooter and e-bike fleet across cities worldwide, adapting the ofo dockless model to electric scooters in the US and beyond.",micro_mobility__dockless_shared_fleet,bird.co
Lime,USA,2017,variant,Lime operates dockless shared e-bikes and e-scooters with per-ride/per-minute pricing via a mobile app across numerous cities globally.,micro_mobility__dockless_shared_fleet,li.me
TIER Mobility,DEU,2018,variant,"TIER Mobility operates a dockless shared e-scooter and e-bike fleet across European cities, replicating the ofo-like model for the European market.",micro_mobility__dockless_shared_fleet,tier.app
VOI Technology,SWE,2018,variant,"VOI operates dockless shared e-scooters and e-bikes in 150+ cities across Europe with per-ride monetization, a clear geo replication of the dockless fleet model.",micro_mobility__dockless_shared_fleet,voi.com
Beam,SGP,2018,variant,"Beam operates a dockless shared e-scooter rental fleet in Asia-Pacific markets, replicating the dockless micro-mobility model from a Singapore base.",micro_mobility__dockless_shared_fleet,ridebeam.com
Neuron Mobility,SGP,2016,variant,"Neuron Mobility operates rental e-scooter and e-bike fleets docklessly in cities across Asia-Pacific and Australia, fitting the shared fleet mechanism precisely.",micro_mobility__dockless_shared_fleet,rideneuron.com
58.com,CHN,2005,variant,"China's leading horizontal classifieds site covering goods, housing, jobs, and services—a direct Craigslist-for-China adaptation.",classifieds__horizontal_classifieds,58.com
Avito,RUS,2007,variant,"Russia's dominant multi-category classifieds platform for goods, real estate, jobs, and services, replicating the Craigslist model.",classifieds__horizontal_classifieds,avito.ru
Dubizzle Group,ARE,2015,variant,"Operates horizontal classifieds portals across MENA and emerging markets covering property, motors, jobs, and general goods.",classifieds__horizontal_classifieds,dubizzlegroup.com
Quikr,IND,2008,variant,"India's free horizontal classifieds platform spanning goods, services, jobs, housing, and vehicles—a clear Craigslist-for-India clone.",classifieds__horizontal_classifieds,quikr.com
Carousell Group,SGP,2012,edge_case,"Carousell Group now operates horizontal classifieds across Southeast Asia (including autos, property, and general goods) through acquisitions of traditional classifieds businesses, though its roots are more mobile-first.",classifieds__horizontal_classifieds,carousell.com
iQiyi,CHN,2010,variant,"iQiyi is China's leading SVOD platform with a massive licensed and original content library behind a subscription paywall, directly replicating the Netflix model for the Chinese market.",media_entertainment__svod_streaming,iq.com
Hotstar,IND,2000,variant,Hotstar (now Disney+ Hotstar) is India's dominant SVOD streaming platform offering a large multi-genre catalog of licensed and original content behind subscription and freemium tiers.,media_entertainment__svod_streaming,hotstar.com
Viu,HKG,2015,variant,"Viu is a subscription video streaming service operating across Hong Kong and Southeast Asia with licensed Asian drama and original content, replicating the Netflix model regionally.",media_entertainment__svod_streaming,viu.com
MUBI,GBR,2007,variant,MUBI is a curated global SVOD streaming service and production company offering a subscription-based catalog of hand-picked films.,media_entertainment__svod_streaming,mubi.com
Vidio,IDN,2014,variant,"Vidio is Indonesia's leading OTT video platform offering licensed and original long-form content behind a subscription paywall, serving as the Netflix equivalent for Indonesia.",media_entertainment__svod_streaming,vidio.com
Lashou.com,CHN,2010,variant,"A direct Groupon clone for China, operating a location-based social commerce platform selling curated local deals.",ecommerce_horizontal__daily_deals,lashou.com
Meituan,CHN,2010,variant,Originated as China's leading Groupon-style group-buying platform for local services before evolving into a broader local commerce super-app.,ecommerce_horizontal__daily_deals,meituan.com
Kingsoft Cloud,CHN,2012,variant,"Kingsoft Cloud is a leading Chinese public IaaS cloud provider offering compute, storage, and distribution services to businesses and developers in a market where US hyperscalers face regulatory barriers.",cloud_infra__iaas_cloud_platform,ksyun.com
QingCloud,CHN,2012,variant,"QingCloud explicitly provides IaaS-based flexible cloud services (compute, storage, networking) in China as a domestic alternative to AWS/Azure/GCP.",cloud_infra__iaas_cloud_platform,qingcloud.com
Personio,DEU,2015,variant,"Personio is a comprehensive cloud HR and payroll platform built specifically for European SMEs, deeply localized for German/EU labor and tax compliance.",hr_workforce__smb_cloud_hr_payroll,personio.com
PayFit,FRA,2015,variant,"PayFit automates payroll and HR processes for SMBs in France (and expanding in Europe), serving as a clear Gusto-for-France replicator with deep French payroll compliance.",hr_workforce__smb_cloud_hr_payroll,payfit.com
Employment Hero,AUS,2014,variant,"Employment Hero is an Australian cloud platform managing HR, payroll, and employee benefits for SMBs with deep Australian compliance integration.",hr_workforce__smb_cloud_hr_payroll,employmenthero.com
Factorial,ESP,2016,variant,"Factorial is a Spain-based cloud HR platform automating payroll, time tracking, and HR administration for European SMBs with localized compliance.",hr_workforce__smb_cloud_hr_payroll,factorialhr.com
SmartHR,JPN,2013,variant,"SmartHR is a cloud-native HR management platform for Japanese businesses, localizing social insurance, labor procedures, and payroll compliance for the Japanese market.",hr_workforce__smb_cloud_hr_payroll,smarthr.co.jp
Stori,MEX,2019,variant,"Stori explicitly replicates the Nubank playbook in Mexico, offering a no-fee credit card as the entry wedge for underserved consumers with limited credit history.",fintech_neobanking__emerging_market_card_neobank,storicard.com
Plata,MEX,2023,variant,"Plata provides a credit card with a rewards program in Mexico targeting underserved consumers, directly mirroring the Nubank card-first entry wedge.",fintech_neobanking__emerging_market_card_neobank,platacard.mx
"Ualá",ARG,2017,variant,"Ualá launched with a prepaid card as its entry product for underbanked Argentine consumers, then expanded into lending, investments, and insurance — a textbook Nubank-for-Argentina play.",fintech_neobanking__emerging_market_card_neobank,uala.com.ar
slice,IND,2016,variant,"slice entered India's underbanked market with a mobile-first credit card for young consumers and is now building a full-stack digital bank, replicating the Nubank mechanism.",fintech_neobanking__emerging_market_card_neobank,slicebank.com
FPL Technologies,IND,2019,variant,"FPL Technologies is building a mobile-first credit card from first principles for Indian consumers, using the card as the primary acquisition wedge in an underserved market.",fintech_neobanking__emerging_market_card_neobank,onescore.app
Udaan,IND,2016,variant,"India's leading eB2B platform connecting small retailers with wholesalers/manufacturers for FMCG and everyday goods, directly replicating the Huimin model.",b2b_marketplace__small_retailer_fmcg,udaan.com
Chiper,COL,2018,variant,"B2B e-commerce ecosystem purpose-built for corner stores in Latin America, providing FMCG sourcing, delivery, and credit—classic geo replication.",b2b_marketplace__small_retailer_fmcg,chiper.co
Ula,IDN,2020,variant,"Indonesian wholesale e-commerce marketplace providing inventory sourcing and working capital to small warung/shop owners, a direct Udaan/Huimin-style adaptation.",b2b_marketplace__small_retailer_fmcg,ula.app
Jumbotail,IND,2015,variant,Full-stack B2B marketplace for food and grocery distribution to small/independent retailers (kirana stores) in India with embedded logistics and credit.,b2b_marketplace__small_retailer_fmcg,jumbotail.com
ElasticRun,IND,2016,variant,"ElasticRun is an Indian technology-driven distribution platform that connects FMCG brands with small and underserved rural/semi-urban retailers via app-based ordering and managed logistics, operating in the same Indian kirana-digitization space as Udaan and Jumbotail.",b2b_marketplace__small_retailer_fmcg,elastic.run
Mercari,JPN,2013,variant,"Mercari is Japan's leading mobile-first C2C secondhand marketplace with photo-centric listings, in-app payments, and shipping — a direct OfferUp analog for Japan.",classifieds__mobile_c2c_secondhand,mercari.com
Wallapop,ESP,2013,variant,"Wallapop is a hyper-local, mobile-first C2C secondhand goods marketplace in Spain, replicating the OfferUp model with location-based discovery.",classifieds__mobile_c2c_secondhand,wallapop.com
letgo,TUR,2015,variant,"Letgo is a mobile-first C2C marketplace for used goods originating in Turkey, directly mirroring OfferUp's ultra-low-friction photo-to-listing model.",classifieds__mobile_c2c_secondhand,letgo.com
Carousell Group,SGP,2012,variant,"Carousell Group operates mobile-first C2C secondhand marketplaces across Southeast Asia, directly replicating the OfferUp mechanism in multiple Asian geographies.",classifieds__mobile_c2c_secondhand,carousell.com
Horizon Robotics,CHN,2015,variant,"Horizon Robotics designs proprietary automotive-grade Journey SoCs bundled with ADAS/AD perception software and sells integrated platforms to Chinese OEMs for series production, directly replicating Mobileye's model for China.",av_robotics__adas_chip_platform,horizon.cc
Black Sesame Technologies,CHN,2016,variant,"Black Sesame Technologies develops its own automotive-grade ADAS/AD SoCs (Huashan series) with integrated perception software, selling the platform to Chinese OEMs in a clear Mobileye-for-China pattern.",av_robotics__adas_chip_platform,bst.ai
Weipinhui,CHN,2008,variant,"Former anchor, demoted in Phase 3b re-election. Original rationale: Vipshop is the canonical originator of the flash-sale branded discount e-commerce model in China, offering time-limited sales of well-known brands at deep discounts.",ecommerce_horizontal__flash_sale_branded_discount,vipshop.com
Global Data Solutions,CHN,2000,variant,"GDS designs, builds, and operates colocation data centers in China, serving hyperscale and enterprise tenants under long-term contracts — a direct Equinix-for-China model.",cloud_infra__colocation_datacenter,gds-services.com
Princeton Digital Group,SGP,2018,variant,"Princeton Digital Group invests in, develops, and operates data center infrastructure across Asia, leasing capacity to hyperscale cloud and enterprise customers — Equinix-for-Asia-Pacific.",cloud_infra__colocation_datacenter,princetondg.com
DayOne,SGP,2022,variant,"DayOne develops and operates hyperscale digital infrastructure in Southeast Asia, leasing data center capacity to cloud, AI, and enterprise customers — Equinix-for-Singapore/SEA.",cloud_infra__colocation_datacenter,dayonedc.com
Zalando,DEU,2008,variant,"Rocket Internet clone of Zappos for Europe, now Europe's largest multi-brand online fashion retailer with the same free shipping/returns playbook.",ecom_vertical__multi_brand_fashion_retail,zalando.com
Dafiti,BRA,2010,variant,"Rocket Internet clone of Zappos for Brazil/Latin America, offering multi-brand fashion retail with the same logistics-heavy, free-returns model.",ecom_vertical__multi_brand_fashion_retail,dafiti.com.br
Global Fashion Group,LUX,2014,variant,Rocket Internet umbrella operating Zappos-like multi-brand fashion e-commerce platforms across 27+ emerging markets.,ecom_vertical__multi_brand_fashion_retail,global-fashion-group.com
ABOUT YOU,DEU,2014,variant,Major European multi-brand fashion retailer offering personalized shopping across thousands of third-party brands with free shipping and returns.,ecom_vertical__multi_brand_fashion_retail,aboutyou.com
VIPKID,CHN,2013,variant,China-based platform replicating the iTutorGroup model by connecting Chinese students with North American tutors for live 1-on-1 English tutoring sessions via proprietary video technology.,edtech__live_tutoring_platform,vipkid.com
GoStudent,AUT,2016,variant,"Austria-based live tutoring marketplace that matches K-12 students with vetted tutors for 1-on-1 video sessions, handling scheduling, payments, and quality assurance across European markets.",edtech__live_tutoring_platform,gostudent.org
Vedantu,IND,2011,variant,"India-based live online tutoring platform connecting students with tutors for 1-on-1 and small-group interactive sessions for academic and competitive exam prep, with platform-managed scheduling and payments.",edtech__live_tutoring_platform,vedantu.com
Clara,BRA,2020,variant,Clara is a Brex-like corporate card and end-to-end spend management platform built for Latin American businesses.,fintech_infra__corporate_card_spend_mgmt,clara.com
Volopay,SGP,2019,variant,"Volopay issues corporate cards with automated payables and spend controls for businesses in the APAC region, a clear Brex-for-Singapore/SEA model.",fintech_infra__corporate_card_spend_mgmt,volopay.com
Payhawk,GBR,2018,variant,"Payhawk offers global corporate cards with expense tracking, automated payables, and real-time financial controls for European businesses.",fintech_infra__corporate_card_spend_mgmt,payhawk.com
Spenmo,SGP,2019,variant,"Spenmo offers corporate cards and expense management for finance teams in Southeast Asia, replicating the Brex model for the SGP/SEA geography.",fintech_infra__corporate_card_spend_mgmt,spenmo.com
Zai Lab,CHN,2014,variant,"Zai Lab's core model is in-licensing transformative medicines from Western biotech/pharma for clinical development and commercialization in China, a textbook geo-variant of SymBio for the Chinese market.",healthtech_biotech__in_license_develop_local_market,zailaboratory.com
JW Therapeutics,CHN,2016,variant,"JW Therapeutics was a joint venture formed specifically to in-license Juno/BMS CAR-T technology and commercialize it in China, fitting the in-license-and-localize playbook precisely.",healthtech_biotech__in_license_develop_local_market,jwtherapeutics.com
Ninja Van,SGP,2014,variant,Known example; tech-enabled e-commerce express parcel delivery network operating its own sorting and delivery infrastructure across Southeast Asia.,logistics_supply_chain__ecommerce_parcel_delivery,ninjavan.co
J&T Express,IDN,2015,variant,"Known example; J&T Express built a full-stack e-commerce parcel delivery network with owned sorting hubs and last-mile fleet, originating in Indonesia.",logistics_supply_chain__ecommerce_parcel_delivery,jet.co.id
Xpressbees,IND,2015,variant,"Known example; Indian e-commerce express delivery company operating its own sorting infrastructure and delivery fleet, directly competing with Delhivery.",logistics_supply_chain__ecommerce_parcel_delivery,xpressbees.com
Northvolt,SWE,2016,variant,Northvolt is explicitly replicating the CATL gigafactory playbook in Sweden/Europe to supply European OEMs like BMW and Volkswagen with locally produced battery cells.,cleantech__battery_gigafactory,northvolt.com
Verkor,FRA,2020,variant,"Verkor is building a gigafactory in Dunkirk, France to manufacture low-carbon battery cells for European automotive OEMs including Renault, directly replicating the CATL model for France.",cleantech__battery_gigafactory,verkor.com
Britishvolt,GBR,2019,variant,"Britishvolt aimed to build the UK's first gigafactory for automotive battery cells to provide domestic supply sovereignty, a direct geo-replication of the CATL playbook for the UK (though it entered administration).",cleantech__battery_gigafactory,britishvolt.com
Parloa,DEU,2018,variant,"Parloa is the known European (Germany) adaptation of Ada's AI-first contact center automation model, building an AI agent management platform to automate customer interactions for enterprises.",ai_ml_vertical__ai_customer_support_chatbot,parloa.com
Decagon,USA,2023,variant,"Decagon provides a conversational AI platform purpose-built for automating customer support across multiple channels, directly replicating Ada's mechanism in the US market.",ai_ml_vertical__ai_customer_support_chatbot,decagon.ai
Sierra,USA,2023,variant,"Sierra builds and manages conversational AI agents specifically for customer experiences, functioning as a direct US competitor to Ada with the same AI-first support resolution model.",ai_ml_vertical__ai_customer_support_chatbot,sierra.ai
Nuvemshop,BRA,2010,variant,"Nuvemshop is the leading Shopify-equivalent in Brazil, providing SMBs with self-serve tools to set up, manage, and promote their own online stores.",ecommerce_horizontal__storefront_saas,nuvemshop.com.br
Facily,BRA,2018,variant,"Facily is a Brazilian social commerce marketplace focused on low-ticket items with group-buying mechanics, replicating the Pinduoduo model for Brazil.",ecommerce_horizontal__social_group_buying,faci.ly
