n,cc,y,r,rat,f,d
Yidao Yongche,CHN,2010,edge_case,"Yidao Yongche was an early Chinese ride-hailing platform connecting riders with drivers via app, though its description as 'professional car reservation services' suggests partial fleet elements.",ride_hailing__marketplace,yongche.biz
Lending Club,USA,2007,variant,"Lending Club is the defining US replication of Zopa's P2P marketplace, connecting borrowers with individual and institutional investors via an online platform.",fintech_lending__p2p_marketplace,lendingclub.com
Prosper Marketplace,USA,2005,variant,"Prosper Marketplace is a direct US competitor to Lending Club, operating the same two-sided P2P marketplace matching borrowers with investor-lenders.",fintech_lending__p2p_marketplace,prosper.com
Lufax,CHN,2011,variant,"Lufax is China's largest P2P/marketplace lending platform, matching borrowers with individual and institutional investors in a direct replication of the Zopa model.",fintech_lending__p2p_marketplace,lu.com
Dianrong,CHN,2013,variant,"Dianrong is a Chinese online marketplace lending platform explicitly designed to connect borrowers with investors, co-founded by a Lending Club co-founder.",fintech_lending__p2p_marketplace,dianrong.com
Tuandaiwang,CHN,2012,variant,Tuandaiwang is a Chinese peer-to-peer lending platform that matches borrowers with individual investor-lenders via its online marketplace.,fintech_lending__p2p_marketplace,tuandai.com
Weidai,CHN,2011,variant,"Weidai is explicitly described as a China-based P2P lending platform, directly matching borrowers with individual and institutional investors.",fintech_lending__p2p_marketplace,weidai.com.cn
Plenti,AUS,2014,variant,"Plenti (formerly RateSetter Australia) is an Australian P2P lending platform matching borrowers with investor-lenders, replicating the Zopa model for Australia.",fintech_lending__p2p_marketplace,plenti.com.au
9F Group,CHN,2006,edge_case,9F Group operated a Chinese P2P lending marketplace connecting borrowers with individual and institutional investors as a core part of its digital financial platform.,fintech_lending__p2p_marketplace,9fgroup.com
SoFi,USA,2011,edge_case,"SoFi originated as a P2P marketplace matching student borrowers with alumni investors but has since evolved into a full-service digital bank, moving beyond the pure marketplace model.",fintech_lending__p2p_marketplace,sofi.com
Biren Technology,CHN,2019,variant,Chinese AI chip startup designing GPU and DSA-architecture intelligent processors as a domestic alternative amid US export controls.,ai_ml_platform__ai_accelerator_chip,birentech.com
Moore Threads,CHN,2020,variant,Chinese GPU designer providing graphics processing technology and services to corporate clients as a domestic NVIDIA alternative.,ai_ml_platform__ai_accelerator_chip,mthreads.com
Cambricon Technologies,CHN,2016,variant,"Chinese AI chip company building core processor chips for intelligent cloud servers, terminals, and robots with its own software stack.",ai_ml_platform__ai_accelerator_chip,cambricon.com
Rebellions,KOR,2020,variant,South Korean AI accelerator chip designer developing inference-optimized silicon and data center systems for large-scale AI workloads.,ai_ml_platform__ai_accelerator_chip,rebellions.ai
Graphcore,GBR,2016,variant,"UK-based company designing the Intelligence Processing Unit (IPU), a novel AI accelerator architecture with its own Poplar software stack.",ai_ml_platform__ai_accelerator_chip,graphcore.ai
Hailo,ISR,2017,variant,"Israeli company designing dedicated AI processors optimized for edge inference, replicating the AI chip model for edge deployment.",ai_ml_platform__ai_accelerator_chip,hailo.ai
Horizon Robotics,CHN,2015,variant,"Horizon Robotics designs its own AI inference processors (BPU series) with an integrated software stack, targeting edge AI for autonomous driving — a clear AI accelerator chip designer in the automotive/edge domain.",ai_ml_platform__ai_accelerator_chip,horizon.cc
Black Sesame Technologies,CHN,2016,variant,Chinese company designing AI accelerator chips targeting autonomous driving and edge AI inference applications.,ai_ml_platform__ai_accelerator_chip,bst.ai
NextSilicon,ISR,2017,edge_case,"Israeli company designing novel HPC compute architectures that overlap with AI workloads, though not exclusively focused on AI acceleration.",ai_ml_platform__ai_accelerator_chip,nextsilicon.com
Despegar,ARG,1999,variant,"Despegar is the leading Latin American OTA offering flights, hotels, and packages to consumers—a clear Expedia-for-LatAm clone.",travel_hospitality__full_service_ota,despegar.com.ar
MakeMyTrip.com,IND,2000,variant,"MakeMyTrip is India's leading full-service OTA providing flights, hotels, holiday packages, and bus bookings from multiple suppliers.",travel_hospitality__full_service_ota,makemytrip.com
Trip.com,SGP,1999,variant,"Trip.com (Ctrip international brand) is a major full-service OTA offering flights, hotels, and packaged tours across Asia and globally.",travel_hospitality__full_service_ota,trip.com
Despegar USA,,1999,variant,"Despegar USA is the same Latin American full-service OTA brand enabling consumers to search and book flights, hotels, and travel packages.",travel_hospitality__full_service_ota,despegar.com
Yatra,IND,2006,variant,"Yatra is a major Indian OTA enabling consumers to search and book flights, hotels, and holiday packages from multiple suppliers.",travel_hospitality__full_service_ota,yatra.com
LY.com,CHN,2004,variant,"LY.com is a Chinese full-service OTA enabling consumers to book flights, hotels, and travel tickets from multiple suppliers.",travel_hospitality__full_service_ota,ly.com
Tuniu,CHN,2006,variant,Tuniu is a Chinese consumer OTA specializing in packaged tours and travel products with flight and hotel booking capabilities.,travel_hospitality__full_service_ota,tuniu.com
Hopper,CAN,2007,variant,"Hopper is a mobile-first OTA using predictive analytics to help consumers book flights, hotels, and car rentals directly on-platform.",travel_hospitality__full_service_ota,hopper.com
ixigo,IND,2006,edge_case,"ixigo has evolved from metasearch into a full-service Indian OTA enabling direct booking of flights, trains, buses, and hotels.",travel_hospitality__full_service_ota,ixigo.com
Yanolja,KOR,2005,edge_case,"Yanolja is Korea's leading accommodation/leisure booking platform with expanding travel services, though it is more accommodation-centric than a full-service OTA.",travel_hospitality__full_service_ota,yanolja.in
Lvmama,CHN,2008,edge_case,"Lvmama is a Chinese B2C tourism platform offering scenic tickets, hotel booking, and packaged tours, though its flight inventory is limited compared to full-service OTAs.",travel_hospitality__full_service_ota,lvmama.com
Mistral AI,FRA,2023,variant,"French geo variant training frontier open-weight and proprietary LLMs with API and enterprise offerings, benefiting from EU data-sovereignty positioning.",ai_ml_platform__foundation_model_api,mistral.ai
Cohere,CAN,2019,variant,Canadian geo variant training Command R family of enterprise LLMs with developer API and enterprise platform.,ai_ml_platform__foundation_model_api,cohere.com
AI21 Labs,ISR,2017,variant,Israeli geo variant training Jamba foundation models and commercializing via API and enterprise products.,ai_ml_platform__foundation_model_api,ai21.com
01.AI,CHN,2023,variant,Chinese geo variant training Yi series LLMs for the Chinese market with API and consumer products.,ai_ml_platform__foundation_model_api,01.ai
Z.ai,CHN,2019,variant,Chinese geo variant training GLM foundation models with consumer chat (ChatGLM) and developer API offerings.,ai_ml_platform__foundation_model_api,zhipuai.cn
Moonshot AI,CHN,2023,variant,Chinese geo variant training frontier LLMs and offering Kimi consumer chat product with long-context capabilities.,ai_ml_platform__foundation_model_api,moonshot.ai
MiniMax,SGP,2021,variant,"Chinese-origin company training multimodal foundation models (text, audio, video) with consumer products (Hailuo) and developer APIs.",ai_ml_platform__foundation_model_api,minimaxi.com
StepFun,CHN,2023,variant,Chinese geo variant training Step series large language and multimodal models with API and consumer offerings.,ai_ml_platform__foundation_model_api,stepfun.com
Stability AI,GBR,2019,edge_case,"UK company that trains StableLM language models alongside its image models and offers them via API, though primarily known for image generation.",ai_ml_platform__foundation_model_api,stability.ai
Affirm,USA,2012,variant,US-based BNPL provider offering merchant-integrated installment payments at online checkout with major retailers like Amazon and Shopify merchants.,bnpl_consumer_credit__merchant_checkout_bnpl,affirm.com
Scalapay,ITA,2019,variant,Italian BNPL provider offering pay-in-3/4 interest-free installment options integrated at merchant checkout across Southern Europe.,bnpl_consumer_credit__merchant_checkout_bnpl,scalapay.com
Tabby,SAU,2019,variant,Saudi Arabia-based BNPL provider offering merchant-integrated installment payments at checkout across the Middle East and North Africa.,bnpl_consumer_credit__merchant_checkout_bnpl,tabby.ai
Paidy,JPN,2008,variant,"Japanese BNPL provider enabling cardless installment purchases integrated at merchant online checkout, the Klarna model adapted for Japan.",bnpl_consumer_credit__merchant_checkout_bnpl,paidy.com
Sezzle,USA,2016,variant,US-based BNPL provider offering pay-in-4 interest-free installment plans integrated at merchant e-commerce checkout.,bnpl_consumer_credit__merchant_checkout_bnpl,sezzle.com
Tamara,SAU,2020,variant,Saudi Arabia-based BNPL provider offering split-payment installment options at merchant checkout across MENA markets.,bnpl_consumer_credit__merchant_checkout_bnpl,tamara.com
Akulaku Group,IDN,2016,variant,Indonesian BNPL and digital finance platform offering installment payment options integrated at e-commerce merchant checkouts across Southeast Asia.,bnpl_consumer_credit__merchant_checkout_bnpl,akulaku.com
Advance Intelligence Group,SGP,2016,variant,"Advance Intelligence Group operates Atome, a prominent merchant-integrated BNPL service across Southeast Asia that lets consumers split purchases into interest-free installments at checkout, closely replicating the Klarna playbook.",bnpl_consumer_credit__merchant_checkout_bnpl,advancegroup.com
Zilch,GBR,2018,edge_case,"UK-based BNPL provider offering pay-over-time installment options with merchant integration, though differentiated by an ad-subsidized direct-to-consumer model.",bnpl_consumer_credit__merchant_checkout_bnpl,zilch.com
Kredivo Group,SGP,2015,edge_case,Singapore-headquartered provider offering instant BNPL credit at e-commerce checkout in Indonesia through integrations with major marketplace platforms.,bnpl_consumer_credit__merchant_checkout_bnpl,kredivocorp.com
Sunbit,USA,2016,edge_case,"US-based point-of-sale BNPL provider integrating at service-merchant checkouts (auto, dental, optical) to offer consumers installment payments with proprietary underwriting.",bnpl_consumer_credit__merchant_checkout_bnpl,sunbit.com
Razorpay,IND,2014,variant,"Stripe for India — developer-first API payment gateway adapted for Indian payment methods (UPI, wallets, net banking) and local regulations.",fintech_payments__api_payment_gateway,razorpay.com
Paystack,NGA,2015,variant,"Stripe for Nigeria/Africa — API-first payment gateway enabling African businesses to accept online payments with local payment method coverage.",fintech_payments__api_payment_gateway,paystack.com
Xendit,IDN,2014,variant,"Stripe for Indonesia/Southeast Asia — developer-friendly API payment platform covering local payment methods like bank transfers and e-wallets.",fintech_payments__api_payment_gateway,xendit.co
Flutterwave,USA,2016,variant,API payment gateway for African markets enabling businesses to accept payments across multiple African countries via developer-friendly APIs.,fintech_payments__api_payment_gateway,flutterwave.com
Kushki,ECU,2017,variant,"Stripe for Latin America — integrated API payments platform supporting local payment methods across multiple LatAm countries.",fintech_payments__api_payment_gateway,kushki.com
Rapyd,GBR,2016,variant,Global API-first payments platform that aggregates and simplifies local payment methods across many geographies for developer integration.,fintech_payments__api_payment_gateway,rapyd.net
dLocal,URY,2016,edge_case,"API payment gateway specializing in enabling cross-border merchants to accept and send payments across emerging markets in Africa, Asia, and Latin America.",fintech_payments__api_payment_gateway,dlocal.com
Airwallex,SGP,2015,edge_case,"Offers API-based online payment acceptance alongside its primary cross-border treasury product, fitting the model partially for global internet businesses.",fintech_payments__api_payment_gateway,airwallex.com
GoCardless,GBR,2011,edge_case,"Developer-first API platform for collecting bank-to-bank (direct debit) payments, applying the Stripe-like developer experience to recurring bank payment collection.",fintech_payments__api_payment_gateway,gocardless.com
iZettle,SWE,2010,variant,"iZettle pioneered the Square-like mPOS card reader and app model for small businesses across Europe, starting in Sweden.",fintech_payments__mpos_smb_card_acceptance,zettle.com
SumUp,GBR,2011,variant,SumUp provides affordable mobile card readers with simple pricing for micro and small merchants across Europe and beyond.,fintech_payments__mpos_smb_card_acceptance,sumup.co.uk
Clip,MEX,2012,variant,Clip is the leading mPOS card reader and digital payments platform enabling small merchants in Mexico to accept card payments.,fintech_payments__mpos_smb_card_acceptance,clip.mx
Flatpay,DNK,2022,variant,"Flatpay provides POS terminals and payment processing to SMB merchants in Denmark with flat-rate pricing, replicating the Square model.",fintech_payments__mpos_smb_card_acceptance,flatpay.com
CloudWalk,BRA,2013,variant,"CloudWalk provides smart POS payment terminals to small and micro-merchants in Brazil, enabling card acceptance in a cash-heavy market.",fintech_payments__mpos_smb_card_acceptance,cloudwalk.io
Teya,GBR,2019,variant,"Teya (formerly Saltpay) provides affordable card payment terminals and business tools to SMBs in Europe with fair, simplified pricing.",fintech_payments__mpos_smb_card_acceptance,teya.com
Mercado Pago,BRA,2004,edge_case,"Mercado Pago offers mPOS card readers (Point) with flat-rate pricing for small merchants across Latin America, directly replicating the Square model.",fintech_payments__mpos_smb_card_acceptance,mercadopago.com.br
Viva Wallet,GRC,2010,edge_case,Viva Wallet offers cloud-based card acceptance terminals for SMBs in Southern Europe with simplified onboarding and competitive pricing.,fintech_payments__mpos_smb_card_acceptance,vivawallet.com
Moniepoint,GBR,2015,edge_case,"Moniepoint distributes POS terminals to merchants and agents in Nigeria, enabling card and digital payment acceptance for previously cash-only businesses.",fintech_payments__mpos_smb_card_acceptance,moniepoint.com
OPay,NGA,2018,edge_case,"OPay deploys POS terminals to agents and small merchants in Nigeria to enable digital payment acceptance, though it also functions as a broader fintech super-app.",fintech_payments__mpos_smb_card_acceptance,opayweb.com
BigBasket,IND,2011,variant,"India's leading 1P online supermarket operating its own warehouses with scheduled delivery across time windows, a direct FreshDirect-for-India analog.",quick_commerce__scheduled_online_grocery_retailer,bigbasket.com
Rohlik,CZE,2014,variant,Czech online grocery retailer with own warehouses and scheduled same-day/next-day delivery windows across Central Europe.,quick_commerce__scheduled_online_grocery_retailer,rohlik.group
Oda,NOR,2013,variant,"Norwegian online grocery retailer with centralized fulfillment and scheduled door-to-door delivery, the FreshDirect model for Scandinavia.",quick_commerce__scheduled_online_grocery_retailer,oda.com
Picnic,NLD,2015,variant,"Dutch online grocer with 1P inventory, centralized fulfillment, and scheduled time-window delivery via electric vans.",quick_commerce__scheduled_online_grocery_retailer,picnic.app
Market Kurly,KOR,2015,variant,South Korean 1P online grocery retailer with its own fulfillment centers and overnight/next-day scheduled delivery (dawn delivery).,quick_commerce__scheduled_online_grocery_retailer,kurly.com
Benlai,CHN,2012,variant,"Chinese fresh produce e-commerce platform operating 1P inventory from regional warehouses with scheduled delivery, a known example in this playbook.",quick_commerce__scheduled_online_grocery_retailer,benlai.com
Yiguo.com,CHN,2005,variant,"One of China's earliest fresh food e-commerce platforms selling from own cold-chain warehouses with scheduled delivery, replicating the FreshDirect model for China.",quick_commerce__scheduled_online_grocery_retailer,yiguo.com
Licious,IND,2015,edge_case,Indian online meat and seafood retailer with end-to-end 1P supply chain and scheduled delivery; fits as a niche specialty variant though limited to a single fresh-food subcategory.,quick_commerce__scheduled_online_grocery_retailer,licious.in
Bitso,MEX,2014,variant,Bitso is Mexico's leading regulated retail crypto exchange offering local-currency (MXN) fiat on/off-ramps via domestic banking integration.,crypto__regulated_retail_cex,bitso.com
CoinDCX,IND,2018,variant,"CoinDCX is an India-focused regulated retail crypto exchange with INR fiat rails and local KYC, serving mainstream Indian crypto investors.",crypto__regulated_retail_cex,coindcx.com
Dunamu,KOR,2012,variant,"Dunamu operates Upbit, South Korea's dominant regulated retail crypto exchange with KRW fiat on-ramps and local VASP registration.",crypto__regulated_retail_cex,dunamu.com
CoinSwitch,IND,2017,variant,"CoinSwitch is an India-focused retail crypto exchange platform with INR on-ramps and local regulatory compliance, directly competing with CoinDCX.",crypto__regulated_retail_cex,coinswitch.co
Rain,BHR,2017,variant,Rain is a Bahrain-licensed regulated retail crypto exchange serving MENA markets with local fiat currency on/off-ramps and domestic banking partnerships.,crypto__regulated_retail_cex,rain.com
2TM,BRA,2013,variant,"2TM is the parent company of Mercado Bitcoin, Brazil's leading regulated retail crypto exchange with BRL fiat rails and local licensing.",crypto__regulated_retail_cex,2tmgroup.com
Liquid Global,JPN,2014,variant,"Liquid Global is a Japan-based JFSA-licensed retail crypto exchange with JPY fiat rails, serving mainstream Japanese crypto investors.",crypto__regulated_retail_cex,liquid.com
HashKey,JPN,2018,edge_case,"HashKey Group operates a licensed retail virtual asset exchange in Hong Kong under SFC regulation, though the parent group spans broader financial services and consulting.",crypto__regulated_retail_cex,hashkey.com
Freetrade,GBR,2016,variant,"Commission-free self-directed stock and ETF trading platform targeting UK retail investors with a premium subscription tier — Robinhood for the UK.",fintech_neobanking__commission_free_retail_brokerage,freetrade.io
Trade Republic,DEU,2015,variant,"Mobile-first commission-free brokerage offering stocks, ETFs, and crypto to European retail investors — Robinhood for Germany/Europe.",fintech_neobanking__commission_free_retail_brokerage,traderepublic.com
Ajaib,IDN,2019,variant,"Mobile-first zero-commission stock and mutual fund trading app targeting first-time retail investors in Indonesia — Robinhood for Indonesia.",fintech_neobanking__commission_free_retail_brokerage,ajaib.co.id
Groww,IND,2016,variant,"Mobile-first commission-free platform for stocks, mutual funds, and ETFs targeting young Indian retail investors — Robinhood for India.",fintech_neobanking__commission_free_retail_brokerage,groww.in
Tiger Brokers,SGP,2014,edge_case,Mobile-first online brokerage offering low-cost stock and ETF trading to retail investors across Singapore and other Asian markets.,fintech_neobanking__commission_free_retail_brokerage,itiger.com
CoinSwitch,IND,2017,edge_case,"Indian mobile-first investment app (CoinSwitch Kuber) targeting first-time retail investors with simplified crypto and stock trading UX, positioning similar to known examples Groww and Zerodha, though primarily described as a crypto exchange and revenue model relies on spread markup rather than PFOF",fintech_neobanking__commission_free_retail_brokerage,coinswitch.co
Udaan,IND,2016,variant,"Udaan is a horizontal eB2B marketplace in India connecting retailers, wholesalers, and manufacturers across multiple product categories for bulk trade — a direct Alibaba.com-for-India model.",ecommerce_horizontal__b2b_horizontal_marketplace,udaan.com
Moglix,SGP,2015,variant,"Moglix is a B2B online marketplace aggregating manufacturers and distributors of industrial and business supplies across multiple categories for business buyers, directly replicating the Alibaba.com horizontal B2B marketplace playbook in Asia.",ecommerce_horizontal__b2b_horizontal_marketplace,moglix.com
Jumbotail,IND,2015,variant,"Full-stack B2B e-commerce marketplace connecting food and grocery manufacturers/distributors with kirana/SMB retailers in India for bulk purchasing, directly matching the in-scope criterion of B2B platforms targeting kirana/corner stores.",ecommerce_horizontal__b2b_horizontal_marketplace,jumbotail.com
Infra.Market,IND,2016,edge_case,"Indian B2B e-commerce platform aggregating construction-material manufacturers and distributors for business buyers across multiple product categories (cement, steel, pipes, electricals, etc.), operating a marketplace mechanism analogous to Udaan though concentrated on the construction vertical.",ecommerce_horizontal__b2b_horizontal_marketplace,infra.market
Tridge,KOR,2015,edge_case,"B2B trade platform matching global food and agriculture buyers with sellers across many sub-categories, functioning as a cross-border wholesale marketplace though concentrated in a single broad sector.",ecommerce_horizontal__b2b_horizontal_marketplace,tridge.com
Zetwerk,IND,2018,edge_case,"Zetwerk explicitly operates a B2B marketplace connecting business buyers with manufacturers across multiple manufacturing categories (metals, textiles, electronics), though its emphasis on custom/contract manufacturing rather than wholesale catalog purchasing makes it a borderline fit.",ecommerce_horizontal__b2b_horizontal_marketplace,zetwerk.com
Grubhub,USA,2004,variant,"Classic US restaurant food delivery marketplace aggregating local restaurant supply for consumer ordering and delivery, a known example in the playbook.",food_delivery_restaurant__marketplace,grubhub.com
Delivery Hero,DEU,2011,variant,Germany-headquartered global food delivery marketplace operating in dozens of countries with commission-based restaurant aggregation model.,food_delivery_restaurant__marketplace,deliveryhero.com
iFood,BRA,2011,variant,"Brazil's dominant restaurant food ordering and delivery marketplace connecting consumers with restaurants, a known example in the playbook.",food_delivery_restaurant__marketplace,ifood.com.br
Swiggy,IND,2014,variant,"India's leading food delivery marketplace connecting consumers with restaurants via app with managed courier logistics, a known example.",food_delivery_restaurant__marketplace,swiggy.com
Foodpanda,DEU,2012,variant,"Online food delivery marketplace enabling users to order from local restaurants via app/web, operating across Asia and other regions.",food_delivery_restaurant__marketplace,foodpanda.com
Woowa Bros,KOR,2011,variant,"Operator of Baedal Minjok (Baemin), South Korea's leading restaurant food delivery marketplace, a known example in the playbook.",food_delivery_restaurant__marketplace,woowahan.com
ELEME,CHN,2008,variant,China's major online food delivery marketplace (Alibaba-owned) connecting consumers with local restaurants via app with courier logistics.,food_delivery_restaurant__marketplace,ele.me
Kavak,MEX,2016,variant,"Kavak is the Carvana for Latin America (anchored in Mexico), acquiring, inspecting, and retailing used cars online with integrated financing and delivery.",auto_marketplace__fullstack_used_car_ecommerce,kavak.com
CARS24,IND,2015,variant,"CARS24 started as C2B in India and evolved into a full-stack used car retailer with inspection, pricing, financing, and home delivery for consumers.",auto_marketplace__fullstack_used_car_ecommerce,cars24.com
Spinny,IND,2015,variant,"Spinny is an Indian full-stack used car platform that buys, inspects, and sells pre-owned cars directly to consumers with transparent pricing and trust guarantees.",auto_marketplace__fullstack_used_car_ecommerce,spinny.com
Carsome,MYS,2015,variant,Carsome is a Southeast Asian full-stack used car e-commerce platform operating inspection centers and selling reconditioned cars with integrated financing in Malaysia.,auto_marketplace__fullstack_used_car_ecommerce,carsome.my
Carro,SGP,2015,variant,"Carro is a Singapore-based full-stack used car marketplace that holds inventory and offers integrated financing and insurance, replicating the Carvana model in Southeast Asia.",auto_marketplace__fullstack_used_car_ecommerce,carro.sg
Carsome Capital,MYS,2018,edge_case,"Carsome Capital is the financing and e-commerce arm of Carsome, supporting full-stack used car retail with buying, selling, and trading services.",auto_marketplace__fullstack_used_car_ecommerce,carsome.com
SellerX,DEU,2020,variant,"SellerX buys and builds Amazon FBA businesses in Germany/Europe, a clear Thrasio-for-Europe aggregator.",ecommerce_horizontal__fba_brand_aggregator,sellerx.com
Razor Group,DEU,2020,variant,"Razor Group is a Germany-based consumer holding company that acquires and scales e-commerce marketplace brands, directly replicating Thrasio's model.",ecommerce_horizontal__fba_brand_aggregator,razor-group.com
